0,1
,"% of value chain partners (by value of business done with such partners) 
that were assessed"
Health and safety practices,"The  Corporation  expects  all  its  value  chain  partners  to  follow  extant  regulations, 
including health and safety practices and working conditions.  These parameters are 
not explicitly captured or measured other than certain loans where there is enhanced 
environment and social (E&S) due diligence being monitored and health and safety 
and working conditions form an integral component of these monitorables."
Working conditions,
